title,author,author_des,date,views,loves,zans,comment_num,url
风控策略产品经理：金融风控的业务规则、策略模型（认知）,凤城狂客,有个公众号：策略产品经理研习社,2019-05-17,1.6万,110,25,5,http://www.woshipm.com/pmd/2356222.html
解密产品经理“学习能力”打造公式,张小墨,产品经理中的文青儿，公众号：月光坦克,2019-05-17,6756,39,11,0,http://www.woshipm.com/pmd/2272835.html
8个步骤，教你将产品需求掰开揉碎,唐韧,《产品经理必懂的技术那点事儿》作者，公众号：唐韧,2019-05-17,9352,69,18,2,http://www.woshipm.com/pmd/2354860.html
一个案例，告诉你数据产品经理与一般产品经理之间的区别,大林的小白,公众号：互联网er读书会,2019-05-17,1.3万,43,8,11,http://www.woshipm.com/pmd/2354001.html
产品经理入门：快速掌握App设计基本方法之界面,德纲大帝,产品圈里的一届小学生,2019-05-17,6593,82,26,20,http://www.woshipm.com/pmd/2350917.html
产品经理逻辑练习：以美团外卖送红包功能为例,枯叶,公众号：枯叶咖啡馆,2019-05-16,2万,152,45,16,http://www.woshipm.com/pmd/2351947.html
产品经理，该如何在你的业务赛道深耕呢？,花生酱先生,公众号：产品之术 | 高级AI产品经理,2019-05-16,5477,12,8,2,http://www.woshipm.com/pmd/2348691.html
案例分析：从为盲人设计闹钟，来谈一下结构化产品思维,大林的小白,公众号：互联网er读书会,2019-05-16,5830,40,4,5,http://www.woshipm.com/pmd/2347867.html
产品人不能忽视的“创新思维”,张圈圈,专注与热爱产品工作,2019-05-15,5845,17,7,2,http://www.woshipm.com/pmd/2338394.html
非技术转型的产品经理怎么提高沟通效率？（统一名词篇）,杜昭,高级交互设计师，公众号：设计的威严,2019-05-15,3.2万,169,41,31,http://www.woshipm.com/pmd/2341101.html
产品价值公式，一个重要的实用工具,创想佳,如果注定是行动的矮子，就做思想的巨人吧,2019-05-15,5592,27,11,1,http://www.woshipm.com/pmd/2219383.html
产品人的自我修养：从入门到优秀，再到卓越,大林的小白,公众号：互联网er读书会,2019-05-15,4542,22,9,0,http://www.woshipm.com/pmd/2271186.html
产品进阶（1）：如何做好产品助理？,异彩,"微：zxw2321542955
公众号：一只蜗牛慢慢跑",2019-05-14,8890,81,14,0,http://www.woshipm.com/pmd/2340090.html
职场加分：产品经理如何通过做项目来提升工作能力？,大林的小白,公众号：互联网er读书会,2019-05-14,5513,26,6,0,http://www.woshipm.com/pmd/2265079.html
什么样的人适合当个互联网产品经理？,慢思考快思考,微信公众号号：ThinkSlowandFast,2019-05-14,7236,42,15,12,http://www.woshipm.com/pmd/2336693.html
你以为产品经理到了瓶颈期？其实那是新阶段的序曲,慕斯姑娘,微信号musiguniang  公众号“产品那些年”,2019-05-14,2918,15,8,3,http://www.woshipm.com/pmd/2336187.html
养猪业也需要产品经理吗？,瑞子,,2019-05-13,7911,66,14,7,http://www.woshipm.com/pmd/2334974.html
产品经理，你要了解一些音视频技术,流年,不定期分享产品工作中的感悟,2019-05-13,9040,93,13,11,http://www.woshipm.com/pmd/2329683.html
产品经理如何提升同理心和洞察力？,拾贰漫谈,都想涉猎一点点。公众号：拾贰漫谈,2019-05-13,5010,47,11,4,http://www.woshipm.com/pmd/2331206.html
从“吃鸡”过审来看：产品经理如何平衡用户体验、企业需求和技术？,大林的小白,公众号：互联网er读书会,2019-05-11,2640,13,2,1,http://www.woshipm.com/pmd/2328040.html
To B or To C，产品类型如何影响产品经理的工作,大林的小白,公众号：互联网er读书会,2019-05-10,7980,96,9,2,http://www.woshipm.com/pmd/2326963.html
智能硬件之配套软件产品设计总结（1）,风骚产品实践者,请关注我的公众号，风一样的产品实践者,2019-05-08,6265,52,2,3,http://www.woshipm.com/pmd/2317090.html
汽车后市场模式解析之（二）：谁适合做汽后企业的产品经理？,Carl爵爷,,2019-05-08,4338,48,5,9,http://www.woshipm.com/pmd/2316030.html
产品经理天天提MVP，到底该怎么用？,John,微信公众号：产品狗聚集地,2019-05-08,5184,53,6,0,http://www.woshipm.com/pmd/2317290.html
产品经理 | 如何打造自己的逻辑分析模式？,大林的小白,公众号：互联网er读书会,2019-05-08,8675,234,25,0,http://www.woshipm.com/pmd/2312351.html
常见的A/B测试误区分析：重复检验显著性,祁永辉,,2019-05-08,2914,27,1,2,http://www.woshipm.com/pmd/2316032.html
C端产品需求分析：提炼+转化,相关人士,,2019-05-07,1.2万,266,44,11,http://www.woshipm.com/pmd/2310737.html
如果以后不做产品经理了，你打算做什么？,慕斯姑娘,微信号musiguniang  公众号“产品那些年”,2019-05-07,3608,21,4,10,http://www.woshipm.com/pmd/2314577.html
转型做产品经理，你需要这三个能力,大林的小白,公众号：互联网er读书会,2019-05-07,6311,90,12,1,http://www.woshipm.com/pmd/2301782.html
三个优化角度，提高Keep的用户粘性,亚琦亚琦,,2019-05-06,8460,56,10,9,http://www.woshipm.com/pmd/2298923.html
初级产品经理 | 缺乏经验沉淀，该如何写好需求分析报告？,小明,此账号已注销,2019-05-06,1.1万,241,40,6,http://www.woshipm.com/pmd/2307192.html
产品经理实习复盘：参与新产品立项,Glee smile,,2019-05-06,8953,142,25,21,http://www.woshipm.com/pmd/2305244.html
三个案例，讲述产品与研发的沟通方法,打酱油的熊,公众号：打酱油的白熊 欢迎加入一起学习,2019-05-05,1万,129,22,11,http://www.woshipm.com/pmd/2304500.html
4个要点，编写一份接口需求文档,果果,乱七八糟的我呀！,2019-05-05,2.4万,370,75,39,http://www.woshipm.com/pmd/2297401.html
3个机制，落实产品内PBL游戏化策略,大白兔,,2019-05-05,6521,50,20,2,http://www.woshipm.com/pmd/2300739.html
一个项目带你走进产品经理的世界（5）：第一个版本做MVP还是MDP？,佐珥,公众号：产品碎月。追逐梦想的产品人～,2019-05-05,1.2万,61,6,12,http://www.woshipm.com/pmd/2301822.html
11条通用法则，教你产品经理面试通关指南,FatBoy,讲讲产品经理背后的故事。公众号：夜来妖,2019-05-05,1.1万,211,17,19,http://www.woshipm.com/pmd/2301158.html
心理小知识以及在产品中的运用（4）——裂变神器：巴纳姆效应,许卡通,热爱心理学的产品狗,2019-05-05,4618,52,11,1,http://www.woshipm.com/pmd/2299348.html
预估市场规模，从思路/方法/关键概念入手,少穻,"智能硬件产品人
公众号/知乎：少穻",2019-04-30,2.2万,68,9,3,http://www.woshipm.com/pmd/2295080.html
善用三个方法，拒绝靠「想」做需求分析,产品小思考,2B产品 公众号：产品小思考,2019-04-30,1.4万,131,41,19,http://www.woshipm.com/pmd/1021061.html
结构思考力：产品经理必备技能,易猫,,2019-04-30,8153,109,11,3,http://www.woshipm.com/pmd/2292732.html
高级产品面试题拆解：美团为什么收购摩拜？,大林的小白,公众号：互联网er读书会,2019-04-30,9210,84,14,0,http://www.woshipm.com/pmd/2292618.html
手刷产品风控体系的第一环——用户认证,飞行员,支付产品，用户增长领域，移动产品经理,2019-04-29,4619,22,2,0,http://www.woshipm.com/pmd/2290032.html
问题即答案，6个提问启发对方自己找答案,关苏哲,新关点创始人，伟事达总裁教练,2019-04-29,4703,25,6,2,http://www.woshipm.com/pmd/2289923.html
变“小白”，你真的可以吗？,得勿,,2019-04-29,5000,14,13,0,http://www.woshipm.com/pmd/2220395.html
详解产品面试题：如何发布一款产品？,大林的小白,公众号：互联网er读书会,2019-04-29,7029,79,6,2,http://www.woshipm.com/pmd/2287594.html
风控对抗中的常规特征及处置选择,gology,,2019-04-29,8398,99,29,16,http://www.woshipm.com/pmd/2286596.html
“Google工作坊”后，对B端产品日常工作的思考,兮兮,公众号:孤身旅人（ID：gushenlvren）,2019-04-29,5357,61,10,5,http://www.woshipm.com/pmd/2287731.html
致工作越来越难做的产品经理们,赵帅,滴滴AI产品负责人,2019-04-29,1.8万,298,88,47,http://www.woshipm.com/pmd/752370.html
从产品角度，输出一份售前解决方案,Cherie,,2019-04-29,6520,74,9,2,http://www.woshipm.com/pmd/2286166.html
如何正确压缩产品需求？,唐韧,《产品经理必懂的技术那点事儿》作者，公众号：唐韧,2019-04-29,5235,39,8,4,http://www.woshipm.com/pmd/2285336.html
从0到1，如何避开产品需求陷阱？,险峰创,险峰资本官方账号。,2019-04-28,3633,58,7,4,http://www.woshipm.com/pmd/2281034.html
两个思维模型解答：你真的适合做产品经理吗？,余鹏飞,微信公号:Tony如是说,2019-04-28,7279,46,5,3,http://www.woshipm.com/pmd/2282774.html
听了那么多课，为什么还是做不好一款产品？,慕斯姑娘,微信号musiguniang  公众号“产品那些年”,2019-04-28,5643,11,4,0,http://www.woshipm.com/pmd/2281282.html
新入职产品经理怎么快速开展工作？,产品_空,保持空杯心态，做一个安静的产品小学生,2019-04-27,9752,133,25,7,http://www.woshipm.com/pmd/2278646.html
2个方法论，系统掌握产品功能改进方案,Jimmy,深圳 产品经理 微信：yejm666,2019-04-26,1.1万,73,18,2,http://www.woshipm.com/pmd/2275079.html
从签到功能到用户激励体系——产品经理项目实录,岳小鱼,更多产品思考，欢迎关注微信公众号：岳小鱼,2019-04-26,1.7万,182,56,18,http://www.woshipm.com/pmd/2273002.html
产品汪的“野蛮生长”复盘（1）,汐_,一只野蛮生长的产品汪,2019-04-26,1万,67,15,16,http://www.woshipm.com/pmd/2264255.html
面经干货：技术转产品，我成功收割网易/百度云计算产品经理offer,互联浩斯,公众号：互联浩斯。（云计算存储PM）,2019-04-26,1.1万,144,40,38,http://www.woshipm.com/pmd/2275074.html
Google Play优化基础，如何为出海产品做好ASO,Dearxy,海外社区产品经理,2019-04-26,5060,38,7,4,http://www.woshipm.com/pmd/2247286.html
产品经理如何用云笔记构建自己的知识体系？,Cu已掉线,邮箱产品经理,2019-04-26,4311,55,13,6,http://www.woshipm.com/pmd/2257575.html
产品经理对用户体验认知的四大误区,德升,平安好医生UED设计经理,2019-04-26,3545,37,7,8,http://www.woshipm.com/pmd/2271616.html
产品“三观”：解读产品经理的三个思考维度,三点半,尝试新事物总能带来新启发,2019-04-25,1.5万,162,51,15,http://www.woshipm.com/pmd/2270145.html
数据产品经理 | 认清角色、找好定位让你游刃有余,wanghui,,2019-04-25,6803,39,3,2,http://www.woshipm.com/pmd/2268864.html
关于前端页面，产品经理该如何理解/如何设计,sona.xu,,2019-04-24,9398,86,8,3,http://www.woshipm.com/pmd/2265666.html
关于教育类产品，如何快速建立师生关联关系？,张鹏涛TAO,教育产品经理 | 公众号：产品与体验,2019-04-24,1.1万,85,5,10,http://www.woshipm.com/pmd/2265574.html
0经验的我，入行产品经理点滴历程回顾,产品经理大学,帮助大学生和职场人士快速入行产品经理~,2019-04-24,6184,61,4,27,http://www.woshipm.com/pmd/2257730.html
一个项目带你走进产品经理的世界（4）：产品规划,佐珥,公众号：产品碎月。追逐梦想的产品人～,2019-04-24,1.5万,153,27,25,http://www.woshipm.com/pmd/2265779.html
产品经理，项目管理能力真的很重要！,蝴蝶,希望得到各位大佬的指点，VX：fengzijkk,2019-04-24,7178,98,11,14,http://www.woshipm.com/pmd/2256006.html
做产品必备的同理心，你知多少？,慕斯姑娘,微信号musiguniang  公众号“产品那些年”,2019-04-24,1620,18,6,1,http://www.woshipm.com/pmd/2264926.html
登上人人社区首页，我只用这几点方法,NicoleL,公众号:产品小白的产品 学生 求职中,2019-04-23,4933,7,4,7,http://www.woshipm.com/pmd/2259782.html
产品的GTM，其实没有那么难,张圈圈,专注与热爱产品工作,2019-04-23,1.9万,54,8,5,http://www.woshipm.com/pmd/2260793.html
产品经理到底要不要懂技术？,天气不错,,2019-04-23,1.5万,150,44,19,http://www.woshipm.com/pmd/2067874.html
产品经理修炼手册：思维立体化该如何实现？,John,微信公众号：产品狗聚集地,2019-04-22,6439,37,11,2,http://www.woshipm.com/pmd/2255449.html
3个应对策略，践行产品经理“反怼”指南,张小墨,产品经理中的文青儿，公众号：月光坦克,2019-04-22,8418,65,28,11,http://www.woshipm.com/pmd/2247941.html
善用“加减乘除”算法，做好产品战略规划,李凯文,蜂语科技（小米生态链企业）产品总监,2019-04-22,4863,34,9,1,http://www.woshipm.com/pmd/2252787.html
“采坑，填坑”，项目的那些事儿（第七阶段：产品上线及推广）,Leon,"三年经验，公众号：产品Leon
欢迎留言交友",2019-04-22,1739,33,2,2,http://www.woshipm.com/pmd/2252554.html
职业规划：你适合做to B产品经理还是to C产品经理？,韩露,产品leader,2019-04-22,1.7万,225,68,48,http://www.woshipm.com/pmd/2161370.html
B2B产品经理的7个谎言,慢思考快思考,微信公众号号：ThinkSlowandFast,2019-04-22,7265,83,9,8,http://www.woshipm.com/pmd/2253809.html
需求整理，解决剪不断理还乱的数据,猫爪,产品经理，擅长逻辑梳理，热爱数据分析,2019-04-22,4882,56,7,0,http://www.woshipm.com/pmd/2226703.html
详解产品面试题，你最喜欢的产品是什么？,大林的小白,公众号：互联网er读书会,2019-04-20,2万,195,39,10,http://www.woshipm.com/pmd/2248720.html
7条实用干货，带你从0到1搭建“积分商城”,老张,一只运营老狗,2019-04-20,1.5万,142,12,12,http://www.woshipm.com/pmd/2226013.html
UX 背景的产品经理如何打造 B 端产品？（上篇）,Yvonne Wu,数据产品经理/认证 Scrum Master,2019-04-20,5784,75,16,14,http://www.woshipm.com/pmd/2248732.html
数据产品经理之用户需求对接,wanghui,,2019-04-20,5077,59,7,3,http://www.woshipm.com/pmd/2246568.html
探讨Tob SaaS企业的客户交付框架，以及产品经理在交付中的作用,绮丽,,2019-04-20,2816,55,1,1,http://www.woshipm.com/pmd/2245890.html
产品小白升职记：如何设计一个产品？,大林的小白,公众号：互联网er读书会,2019-04-19,1万,406,14,1,http://www.woshipm.com/pmd/2243315.html
产品经理的瓶颈期，如何破局？,慕斯姑娘,微信号musiguniang  公众号“产品那些年”,2019-04-19,6357,35,9,5,http://www.woshipm.com/pmd/2243606.html
2类常用方法，解决需求优先级决策,花四爷,,2019-04-19,6359,42,2,0,http://www.woshipm.com/pmd/2239639.html
产品经理底层核心能力模型,痞M二点五,公众号（痞M二点五）输入产品获取更多教程,2019-04-19,9892,182,92,10,http://www.woshipm.com/pmd/2242494.html
不得不懂的外汇知识，金融产品设计必备,🌸光影流年🌸,,2019-04-19,4668,64,16,2,http://www.woshipm.com/pmd/2239868.html
产品！你为什么又惹技术小哥哥生气,牛奶,公众号：产品经理的小红书,2019-04-19,5996,36,11,21,http://www.woshipm.com/pmd/2239416.html
做好项目管理，总共分几步？,大林的小白,公众号：互联网er读书会,2019-04-18,1.6万,265,22,8,http://www.woshipm.com/pmd/2226120.html
5个要点，避免踩坑小程序,Yanssie,论一只产品汪的个人修养,2019-04-18,6092,104,12,1,http://www.woshipm.com/pmd/2211008.html
产品生命周期的4个阶段，产品经理该怎么做？,即能,「即能Upskill」公众号，深耕职场教育领域,2019-04-17,1.5万,98,7,2,http://www.woshipm.com/pmd/2233378.html
如何改进一个产品，详解产品经理面试经典问题,大林的小白,公众号：互联网er读书会,2019-04-17,2.2万,292,71,10,http://www.woshipm.com/pmd/2231646.html
一个项目带你走进产品经理的世界（3）从用户需求到产品功能,佐珥,公众号：产品碎月。追逐梦想的产品人～,2019-04-16,1.8万,117,28,31,http://www.woshipm.com/pmd/2226965.html
信息输出：怎么把决策执行落地，解决“如何做到”,十八线PM,微信公众号：十八线PM。,2019-04-15,1.2万,107,40,23,http://www.woshipm.com/pmd/2219876.html
3个步骤，完成一次B端产品的需求分析,魔力猫,深圳野生动物园兼职长颈鹿喂养师,2019-04-15,1.2万,132,22,18,http://www.woshipm.com/pmd/2215855.html
中级产品方法论（四）：把自己变成用户,求愚,社交产品经理•wx:470341376,2019-04-15,1653,17,1,0,http://www.woshipm.com/pmd/2220347.html
数据产品经理，一切从用户出发！？,wanghui,,2019-04-12,3387,17,12,2,http://www.woshipm.com/pmd/2211115.html
项目验收，产品上线前的最后一道防线,船长,,2019-04-12,6833,143,27,4,http://www.woshipm.com/pmd/2206347.html
3个方面，做好一款B端产品的竞品分析,魔力猫,深圳野生动物园兼职长颈鹿喂养师,2019-04-12,1.6万,195,31,16,http://www.woshipm.com/pmd/2205498.html
协调推进步步是坑，产品经理该如何应对？,慕斯姑娘,微信号musiguniang  公众号“产品那些年”,2019-04-11,7339,68,14,5,http://www.woshipm.com/pmd/2205625.html
产品经理，你要懂点API接口知识！,LinKiD,数据产品经理,2019-04-11,2.4万,250,67,39,http://www.woshipm.com/pmd/2203403.html
3年产品经理之路，回顾与再出发,旺仔九号,公众号：产品经理相对论,2019-04-11,1.3万,154,66,35,http://www.woshipm.com/pmd/2202351.html
一个项目带你走进产品经理的世界（2）：需求分析,佐珥,公众号：产品碎月。追逐梦想的产品人～,2019-04-11,1.8万,186,46,32,http://www.woshipm.com/pmd/2202789.html
复盘：100份简历中4人录取，产品经理招聘有何背后逻辑,大白随笔,公众号：大白产品随笔（ID：dabaixuetang）,2019-04-10,1.5万,97,40,38,http://www.woshipm.com/pmd/2199445.html
To B定制类产品：硬件产品需求（上）,老虎,,2019-04-10,1804,23,2,0,http://www.woshipm.com/pmd/2179249.html
作为产品经理，我有我自己的产品观,Evan,探索自己的边界,2019-04-10,4390,22,7,12,http://www.woshipm.com/pmd/2193044.html
产品经理 | 遇上迷茫期？这三个公式助你自我提升,laoguo,,2019-04-09,6054,25,10,3,http://www.woshipm.com/pmd/2184414.html
学习心得 | 我的产品入门之路,产品经理大学,帮助大学生和职场人士快速入行产品经理~,2019-04-09,6446,57,3,20,http://www.woshipm.com/pmd/2188696.html
一个项目带你走进产品经理的世界：叮，您有一个需求请查收！,佐珥,公众号：产品碎月。追逐梦想的产品人～,2019-04-09,2.3万,357,110,68,http://www.woshipm.com/pmd/2182811.html
产品经理12堂广告课：策划能力是工作后的通用“套路”（二）,FatBoy,讲讲产品经理背后的故事。公众号：夜来妖,2019-04-09,3431,30,8,0,http://www.woshipm.com/pmd/2189891.html
数据产品经理必备思维之——用户思维,David,《数据产品经理修炼手册》作者,2019-04-08,8077,75,7,7,http://www.woshipm.com/pmd/2183933.html
产品经理必备的三大要素,独思有疑,专注生活里的商业视角分析，公号：独思有疑,2019-04-08,7837,63,6,4,http://www.woshipm.com/pmd/2184820.html
高阶产品的必备思维模式：产业基本发展规律,三爷,多年名企PM/MBA特约讲师/公众号：三爷茶馆,2019-04-08,7541,29,17,2,http://www.woshipm.com/pmd/1977114.html
产品经理，你有商业思维吗？,青蛙王子,产品是一门手艺，分享人人都需要的产品思维,2019-04-08,9111,107,16,7,http://www.woshipm.com/pmd/2180363.html
To 产品经理：如何理解战略驱动型产品？,大V姐姐,专注于产品运营干货分享！公众号:PMzone,2019-04-07,1.3万,28,6,3,http://www.woshipm.com/pmd/2175180.html
从5个会议入手，聊聊Scrum敏捷开发实战,yoge,公众号：产品练习生,2019-04-06,9571,48,7,4,http://www.woshipm.com/pmd/2175107.html
数据产品经理进阶指南：核心职责及关键能力（1）,陈新涛,微信号xintao_chen，公众号ourStone，小密圈数据人修炼之路,2019-04-03,1.2万,56,11,5,http://www.woshipm.com/pmd/2167773.html
以美食作家做菜的方式，聊一聊产品思维,vitamin,更多内容，请关注公众号：皮酱叨逼叨,2019-04-03,5418,12,6,6,http://www.woshipm.com/pmd/2165471.html
产品经理：画原型只是入门，能做架构才是进阶,杜松,产品经理的公众号：产品微言,2019-04-02,5万,451,103,14,http://www.woshipm.com/pmd/2162254.html
大厂方法论：点解鹅厂产品心法（下篇）,迷路的威廉,2018年超级产品经理网络大赛冠军、社交PM,2019-04-01,1.4万,87,8,8,http://www.woshipm.com/pmd/2157325.html
总结：个人转型中遇到的一些问题，要如何解决？,PM&PM,,2019-04-01,6743,11,0,0,http://www.woshipm.com/pmd/2158492.html
数据产品经理必备思维之——数据思维,David,《数据产品经理修炼手册》作者,2019-04-01,1.4万,120,14,2,http://www.woshipm.com/pmd/2156813.html
产品经理的“御上”之道,善宝橘,桃李不言，下自成蹊。微信公众号：善宝橘,2019-04-01,5920,34,7,1,http://www.woshipm.com/pmd/2153708.html
以农业行业为例：谈谈ToG信息化产品建设分享,清河落河清,一位做农业的产业产品经理,2019-03-30,1.4万,69,11,5,http://www.woshipm.com/pmd/2149146.html
那些做产品教会我的思维方式,独步天涯客,创业者，产品汪，积极上进的热血青年！,2019-03-29,1.8万,83,21,16,http://www.woshipm.com/pmd/2149766.html
适度懒惰是如何催生好产品的？,航,,2019-03-28,3067,4,1,1,http://www.woshipm.com/pmd/2141221.html
工作or创业：产品经理该如何安放躁动的创业心？,慕斯姑娘,微信号musiguniang  公众号“产品那些年”,2019-03-28,8784,54,9,3,http://www.woshipm.com/pmd/2144254.html
转型下半场：注重新型数字产品经理的培养,思特沃克,ThoughtWorks，一家追求卓越软件质量的全球IT咨询公司。,2019-03-28,8937,26,10,1,http://www.woshipm.com/pmd/2141311.html
产品经理的成长瓶颈在哪里？,申悦,36氪产品总监，公众号：pmboxs，微信：s2dongman，欢迎交流,2019-03-28,5095,34,11,3,http://www.woshipm.com/pmd/2139713.html
产品经理如何接坑、抗坑、出坑？,产品包工头,产品经理,2019-03-28,8459,49,14,8,http://www.woshipm.com/pmd/2141886.html
实现产品业绩增长，这是我的5点建议,草木夏,,2019-03-28,5026,9,1,0,http://www.woshipm.com/pmd/2133275.html
产品经理也应关注“微转化”,十八子杀,,2019-03-28,3308,12,0,0,http://www.woshipm.com/pmd/2138728.html
为什么激活是SaaS产品经理最需要关注的指标？,即能,「即能Upskill」公众号，深耕职场教育领域,2019-03-27,1万,54,3,4,http://www.woshipm.com/pmd/2136768.html
复盘：产品经理晋级答辩该注意哪些点？,卡洛儿,腾讯产品经理 | 微信公众号：产品喵要读书,2019-03-26,2.1万,152,45,17,http://www.woshipm.com/pmd/2126658.html
2年PM的忠告：这些坑，你们千万别踩！,草木夏,,2019-03-26,1.4万,47,15,15,http://www.woshipm.com/pmd/2124956.html
PM技术课 | 推荐系统，从原理到实现,李艳宾,,2019-03-26,1.2万,91,12,8,http://www.woshipm.com/pmd/2097224.html
大厂方法论：点解鹅厂产品心法（上篇）,迷路的威廉,2018年超级产品经理网络大赛冠军、社交PM,2019-03-26,3.3万,150,31,14,http://www.woshipm.com/pmd/2127088.html
干货分享：产品经理面试中的那些高频问题,HQ,公众号: 产品那些年，微信：hanqingguoji,2019-03-26,2.9万,323,60,9,http://www.woshipm.com/pmd/2120510.html
产品经理如何去问自己为什么、怎么办？,曼云,荔枝PM,2019-03-26,5600,14,4,0,http://www.woshipm.com/pmd/2126283.html
竞品分析，产品经理必修课之一,十八子杀,,2019-03-25,4.6万,324,68,14,http://www.woshipm.com/pmd/2116138.html
如何拯救让我最痛的一个B端项目？,奋斗De奶爸,产品、解决方案专家，公众号：奶爸的小客栈,2019-03-25,8406,30,10,6,http://www.woshipm.com/pmd/2120154.html
产品经理，如何理解并应用策略？,John,微信公众号：产品狗聚集地,2019-03-25,6069,47,10,0,http://www.woshipm.com/pmd/2088690.html
产品经理忽视的能力也是最应重视的能力：市场及产品认知,败家,公众号：惨品狗,2019-03-25,4918,23,3,2,http://www.woshipm.com/pmd/2115763.html
【天天问每周精选】第68期：产品老司机站住！教教产品新人你的“套路”,天天问,天天问（wen.woshipm.com）产品经理、运营 互助问答中心。,2019-03-25,5137,25,3,0,http://www.woshipm.com/pmd/2112780.html
身为产品经理，为什么活成了“原型仔”？,杜松,产品经理的公众号：产品微言,2019-03-23,2万,87,14,9,http://www.woshipm.com/pmd/2108764.html
产品经理，为什么你总在给产品“救火”？,杜松,产品经理的公众号：产品微言,2019-03-22,1.9万,78,37,7,http://www.woshipm.com/pmd/2108692.html
决策制定：认知水平是基础，逻辑思维是关键,十八线PM,微信公众号：十八线PM。,2019-03-21,1.2万,88,28,20,http://www.woshipm.com/pmd/2101685.html
产品经理 | 以结构化思考的方法，制定产品策略,夏唬人,公众号：夏唬人。某厂商业策略产品经理,2019-03-21,1.1万,52,7,0,http://www.woshipm.com/pmd/2101047.html
从用户思维出发，看产品经理的职场写作,彬,喜欢读书与分享，公众号“有个思享”,2019-03-20,4140,12,1,1,http://www.woshipm.com/pmd/2094384.html
复盘：一款产品从0到1的全过程,杜松,产品经理的公众号：产品微言,2019-03-20,3.3万,207,55,16,http://www.woshipm.com/pmd/2085467.html
《产品经理的认知发展》完结04：情绪,GaraC,《绝密原型档案》作者,2019-03-19,9975,29,2,1,http://www.woshipm.com/pmd/2088462.html
