title,author,author_des,date,views,loves,zans,comment_num,url
关于社会、商业“同质化”的思考,司马特小队,专注B端产品， 订阅号：司马特小分队,2019-12-09,2912,10,5,1,http://www.woshipm.com/pmd/3184599.html
产品经理如何做好行业分析？,善宝橘,桃李不言，下自成蹊。微信公众号：善宝橘,2019-12-09,6765,88,12,2,http://www.woshipm.com/pmd/3188828.html
实例：产品经理如何做产品调研？,小刘,,2019-12-09,3770,19,2,1,http://www.woshipm.com/pmd/3046238.html
区区短信产品，为什么需要配产品经理？,arkgu,寻找无双,2019-12-08,7915,40,5,6,http://www.woshipm.com/pmd/3184542.html
7个要点，分享产品认知方法论,赵林,19届毕业生、创业者，wechatID：赵林随笔,2019-12-08,2388,27,8,4,http://www.woshipm.com/pmd/3186253.html
产品经理，单纯靠培训是不可能成长的,雅格布,用产品思维去做价值投资，公众号：雅格布,2019-12-08,7056,38,21,0,http://www.woshipm.com/pmd/3188034.html
从产品的角度，看星巴克/肯德基的排队方式差异,奇文天翔,某一线互联网公司金融子业务负责人,2019-12-08,8186,14,12,5,http://www.woshipm.com/pmd/3186152.html
什么是需求分析的最高境界？,长弓PM,寻找答案！changgpm.com,2019-12-08,7271,31,15,10,http://www.woshipm.com/pmd/3183475.html
需求分析是什么&案例解析,小PM白又白,,2019-12-07,1.1万,76,28,14,http://www.woshipm.com/pmd/3176698.html
排优先级总被怼，如何科学划分需求优先级？,PM小青柑,高级金融产品经理 公众账号PMvlog,2019-12-06,9085,43,13,4,http://www.woshipm.com/pmd/3181750.html
产品经理方法论：如何进行需求定义？（二）,谢君翊,,2019-12-06,3819,19,5,0,http://www.woshipm.com/pmd/3181463.html
鄙视原型仔？别忘了你也是！,万有青年,互联网小产品，个人公众号：克苛克,2019-12-06,3336,5,31,3,http://www.woshipm.com/pmd/3180762.html
产品经理如何做好需求分析？教你做个抬杠青年！,橘子,公众号：橘子周思录,2019-12-06,6034,66,12,7,http://www.woshipm.com/pmd/3178910.html
用议论文三要素，搞定需求分析（中）,泽,个人公众号：大道产品,2019-12-06,2318,12,2,1,http://www.woshipm.com/pmd/3180680.html
复盘 | 一次硬件产品的用户访谈,Joe,摸爬滚打的硬件产品狗,2019-12-05,5754,40,3,5,http://www.woshipm.com/pmd/2205561.html
一名优秀的产品经理，该如何真正了解用户需求？,Hugo,产品经理,2019-12-05,1176,2,2,1,http://www.woshipm.com/pmd/3173741.html
产品经理工作指南（下）,珣玗琪,公众号：PM珣玗琪,2019-12-05,4803,71,19,7,http://www.woshipm.com/pmd/1300545.html
产品经理工作指南（上）,珣玗琪,公众号：PM珣玗琪,2019-12-04,8652,94,28,1,http://www.woshipm.com/pmd/1225455.html
如何从0到1做一款产品？我的8点思考,鲁鹏,会写代码的产品经理，公众号：个人学习,2019-12-03,1.1万,77,30,14,http://www.woshipm.com/pmd/3166025.html
自信的产品经理，让产品更“自信”,晓翼,不忘初心，用野心创造产品。,2019-12-03,1018,1,2,0,http://www.woshipm.com/pmd/3164847.html
B端项目组件化思考：流程篇,PGDWORKS,公众号：PGDWORKS。,2019-12-03,4545,61,9,4,http://www.woshipm.com/pmd/3165508.html
产品新人搞定资深成员的“5把钥匙”,门外的蔷薇,,2019-12-03,2846,18,15,1,http://www.woshipm.com/pmd/3152040.html
围绕B端产品的那些问题，太难了,慕斯姑娘,微信号musiguniang  公众号“产品那些年”,2019-12-02,1957,9,3,1,http://www.woshipm.com/pmd/2576803.html
3问产品经理,人人都是产品经理,产品经理和运营的成长社区,2019-12-02,4929,46,4,0,http://www.woshipm.com/pmd/3161089.html
数据产品经理：从埋点系统搭建到数据可视化落地,花生酱先生,公众号：产品之术 | 高级AI产品经理,2019-12-02,9422,121,20,6,http://www.woshipm.com/pmd/3161181.html
一个入门级产品经理的工作与成长之路,叫我阿逸,分享我的产品想法、故事；公众号：人云逸云,2019-12-02,1807,14,7,2,http://www.woshipm.com/pmd/3160491.html
8招走出产品评审的困境,阿艺师傅,公众号:tntproduct,2019-12-02,2393,38,10,1,http://www.woshipm.com/pmd/3157811.html
如何进行有效需求分析（4）：场景篇,晓庄同学,公众号：晓庄同学产品笔记,2019-12-02,3858,36,3,2,http://www.woshipm.com/pmd/3159964.html
思考，让你从产品困局突围,026_西伯利亚狼,,2019-12-02,1854,5,5,0,http://www.woshipm.com/pmd/3154431.html
成为K12专家第一步，市场调研不能少,挥戈小生,优胜教育武汉分公司市场经理,2019-12-02,2067,19,4,0,http://www.woshipm.com/pmd/3142403.html
经验分享：2B产品工作中的那些坑,misbone,,2019-12-01,7944,57,22,25,http://www.woshipm.com/pmd/3158134.html
ToG 产品经理，要学项目管理知识吗？,稀奇星球,转载请联系：xiqiplanet@163.com,2019-12-01,6394,12,2,0,http://www.woshipm.com/pmd/3158130.html
初级产品，如何避免返工带来的效率低下？,橙言,产品经理,2019-12-01,4933,18,3,0,http://www.woshipm.com/pmd/3158183.html
在原型设计之前，我如何做需求调研？,小余同学,,2019-11-30,1365,18,3,1,http://www.woshipm.com/pmd/3156072.html
B端产品生命周期：不同阶段，产品经理如何开展工作,产品小思考,2B产品 公众号：产品小思考,2019-11-30,7131,39,5,4,http://www.woshipm.com/pmd/3154440.html
B端产品经理：行业深耕，我总结了4点心得,志齐,,2019-11-30,6198,14,5,3,http://www.woshipm.com/pmd/3150173.html
AI 硬件产品经理是否需要懂技术？我有话要说,AI 产品观,机器视觉产品经理 公众号 aipm001,2019-11-30,1496,13,0,0,http://www.woshipm.com/pmd/3050537.html
产品经理的痛点，痛到无法呼吸,枯叶,公众号：枯叶咖啡馆,2019-11-29,6383,58,39,13,http://www.woshipm.com/pmd/3150219.html
从0到1的思考：5个层级反思产品,刘国华,,2019-11-29,2372,24,7,1,http://www.woshipm.com/pmd/3147173.html
硅谷早期新创产品经理心得,Bastiane,"哈佛商学院,硅谷产品经理aipm.substack.com",2019-11-29,1174,10,2,0,http://www.woshipm.com/pmd/3149743.html
六个阶段，带你了解产品迭代的完整流程,给予,打怪升级中,2019-11-28,9527,20,8,4,http://www.woshipm.com/pmd/3145277.html
关于产品思维和用户思维，你需要知道这5点,赵林,19届毕业生、创业者，wechatID：赵林随笔,2019-11-28,8349,62,17,15,http://www.woshipm.com/pmd/3143538.html
透过《奇葩说》看生态逻辑,油茶,公众号「半碗油茶」,2019-11-28,8073,35,21,4,http://www.woshipm.com/pmd/3144788.html
ToG 产品经理如何面对工作压力？,稀奇星球,转载请联系：xiqiplanet@163.com,2019-11-28,6718,10,7,4,http://www.woshipm.com/pmd/3144327.html
启动研发前，我们怎么去找到种子用户？,IMPM,公主号：一个奋青,2019-11-28,2109,4,2,0,http://www.woshipm.com/pmd/3144205.html
当我成为政务类产品经理，发现工作流程是这样的……,门外的蔷薇,,2019-11-28,3015,14,6,16,http://www.woshipm.com/pmd/3139993.html
拓展思维边界，找到产品突破口,李杭,暂无,2019-11-27,5010,34,7,3,http://www.woshipm.com/pmd/3140407.html
8个步骤，一次完整的产品迭代,产品经理的那点事儿,电商高级产品|公众号:产品经理的那点事儿,2019-11-27,1.1万,139,58,26,http://www.woshipm.com/pmd/3137252.html
产品思维方式：聊聊结构化思维和逻辑思维,AI 产品观,机器视觉产品经理 公众号 aipm001,2019-11-27,1835,11,0,0,http://www.woshipm.com/pmd/3140512.html
复盘：三步做好产品规划,拎壶冲,,2019-11-27,5791,56,8,5,http://www.woshipm.com/pmd/3139684.html
缺少UI和测试的团队，产品经理怎么办？,慕斯姑娘,微信号musiguniang  公众号“产品那些年”,2019-11-27,1083,4,1,1,http://www.woshipm.com/pmd/2680021.html
经验分享：我的产品入行之路,叫我阿逸,分享我的产品想法、故事；公众号：人云逸云,2019-11-27,2347,17,10,10,http://www.woshipm.com/pmd/3135011.html
复盘：首页改版上线的经验教训,天问,微信公众号：想要驭梦的天问,2019-11-27,2557,18,6,9,http://www.woshipm.com/pmd/3137812.html
我这一年的产品求职打怪路,Grace,"野生PM,公众号Grace无聊说",2019-11-25,7595,29,20,10,http://www.woshipm.com/pmd/3129501.html
我的AI硬件产品思维能力：趋势判断、产品机会点、系统思维能力,AI 产品观,机器视觉产品经理 公众号 aipm001,2019-11-25,3136,9,5,1,http://www.woshipm.com/pmd/3130419.html
策略产品经理如何入门？,PM 韭菜,策略产品经理,2019-11-25,4013,42,9,1,http://www.woshipm.com/pmd/3126488.html
实战思考：产品经理要懂技术吗？,夜月沉星,,2019-11-25,4026,22,6,7,http://www.woshipm.com/pmd/3128020.html
那些适合做产品经理的人,朴老师,DY402122152,2019-11-25,4887,32,12,1,http://www.woshipm.com/pmd/3125817.html
B端产品经理工作指南,李金鑫,产品经理。公众号：慢节奏的李金鑫,2019-11-24,1.5万,180,41,11,http://www.woshipm.com/pmd/2580970.html
从产品管理到产品治理,fzcskycn,,2019-11-24,2031,22,6,1,http://www.woshipm.com/pmd/3117331.html
做一个反常识的产品经理,岳小鱼,更多产品思考，欢迎关注微信公众号：岳小鱼,2019-11-23,9819,79,41,12,http://www.woshipm.com/pmd/3123502.html
产品经理的埋点选择,谭永痣,,2019-11-23,6254,40,10,1,http://www.woshipm.com/pmd/3122392.html
ToB产品经理：“客户成功”的历史,赞德,腾讯高级产品经理 | 公众号：赞德说,2019-11-23,1444,10,1,0,http://www.woshipm.com/pmd/3118379.html
领导力：产品经理的软实力,李杭,暂无,2019-11-23,3111,11,3,2,http://www.woshipm.com/pmd/3116780.html
如何进行一次完整的to G产品的竞品分析？,稀奇星球,转载请联系：xiqiplanet@163.com,2019-11-22,5301,38,10,2,http://www.woshipm.com/pmd/3118687.html
想做好需求分析？这3个问题你需要解答,小龙的执着,公众号：来自小龙的执着,2019-11-22,6095,23,12,3,http://www.woshipm.com/pmd/3117417.html
ToB产品经理：客户成功相关的技术有哪些？,赞德,腾讯高级产品经理 | 公众号：赞德说,2019-11-22,1144,12,1,0,http://www.woshipm.com/pmd/3118395.html
产品经理，你还陷在沟通困境里吗？,优雅的小李白,安静的做个野路子产品汪，不以物喜不以物悲,2019-11-22,1181,5,4,2,http://www.woshipm.com/pmd/3114935.html
一道腾讯产品面试题：在场景中思考问题,John,微信公众号：产品狗聚集地,2019-11-22,9880,63,14,15,http://www.woshipm.com/pmd/3113158.html
撰写后台需求文档需要注意的那些事儿,李杭,暂无,2019-11-21,1.3万,228,22,10,http://www.woshipm.com/pmd/3111154.html
我的产品观：感知用户需要明确目标群体,阿翘,微信公众号：阿翘AKIU,2019-11-21,6610,20,4,3,http://www.woshipm.com/pmd/3115640.html
一套产品评估指标，让产品理论落地,囧囧有神,追寻产品商业价值和用户体验的和谐之美,2019-11-21,9183,60,16,12,http://www.woshipm.com/pmd/3113347.html
用议论文三要素，搞定需求分析（上）,泽,个人公众号：大道产品,2019-11-21,6844,16,5,0,http://www.woshipm.com/pmd/3113543.html
痛点和需求，这次彻底搞清楚！,侠之大者,产品.架构 【公众号：侠之大者】,2019-11-21,5304,32,8,5,http://www.woshipm.com/pmd/3113141.html
经验分享 | 如何说出抓人眼球的自我介绍？,薛老板,公众号：薛老板产品派,2019-11-21,6142,49,12,3,http://www.woshipm.com/pmd/3110733.html
35岁，是产品经理的职业分水岭吗？,枯叶,公众号：枯叶咖啡馆,2019-11-21,5604,15,3,3,http://www.woshipm.com/pmd/3112679.html
To B 产品经理：“客户成功”的定义,赞德,腾讯高级产品经理 | 公众号：赞德说,2019-11-20,1572,6,0,0,http://www.woshipm.com/pmd/3109431.html
傲慢与无知，警惕伪需求陷阱,汪仔1516,,2019-11-20,4493,35,7,3,http://www.woshipm.com/pmd/3108461.html
复盘：服务于敏捷开发的项目文档,29号同学,技术型产品经理，我是隔壁的泰山。,2019-11-20,3232,17,3,4,http://www.woshipm.com/pmd/3097647.html
产品经理，从0到1的系统能力,青色,,2019-11-20,7909,66,25,8,http://www.woshipm.com/pmd/3104589.html
冰山模型：如何提高产品经理的市场价值？6个方面,熊不知,微信公众号：熊不知,2019-11-20,1680,23,4,2,http://www.woshipm.com/pmd/3106072.html
面试官是如何判断一个产品经理的能力？,独步天涯客,创业者，产品汪，积极上进的热血青年！,2019-11-19,8673,58,9,0,http://www.woshipm.com/pmd/3105147.html
从“红利”到“实力”，感觉到难的不止你自己,慕斯姑娘,微信号musiguniang  公众号“产品那些年”,2019-11-19,5118,4,4,0,http://www.woshipm.com/pmd/2576531.html
To B 产品经理：“客户成功”的使命,赞德,腾讯高级产品经理 | 公众号：赞德说,2019-11-19,3243,16,2,0,http://www.woshipm.com/pmd/3104935.html
5阶段法，搞定产品优先级,花生酱先生,公众号：产品之术 | 高级AI产品经理,2019-11-19,3060,21,5,1,http://www.woshipm.com/pmd/3103899.html
用文字梳理产品价值观这门玄学,独步天涯客,创业者，产品汪，积极上进的热血青年！,2019-11-19,2089,4,3,0,http://www.woshipm.com/pmd/3094406.html
To G 产品经理日常工作中遇到的9大挑战和解法,稀奇星球,转载请联系：xiqiplanet@163.com,2019-11-18,7271,35,9,7,http://www.woshipm.com/pmd/3098132.html
作为数据产品经理，你需要知道这些技术知识,A.D.,数据/B端产品，微信公众号：吾某,2019-11-18,1.1万,83,9,8,http://www.woshipm.com/pmd/3099467.html
如何进行有效需求分析（3）：流程篇,晓庄同学,公众号：晓庄同学产品笔记,2019-11-18,6387,34,15,5,http://www.woshipm.com/pmd/3099635.html
产品经理如何更好地做决策？,走南闯北小黑妞,同名公号：走南闯北小黑妞,2019-11-18,3932,14,6,0,http://www.woshipm.com/pmd/3099017.html
我所见过的那些「低效」产品经理,雅格布,用产品思维去做价值投资，公众号：雅格布,2019-11-18,1万,114,40,13,http://www.woshipm.com/pmd/3099046.html
经验分享：如何写好一份需求文档？从这几个方面下手,可缓缓归矣,,2019-11-16,1896,11,2,1,http://www.woshipm.com/pmd/3083282.html
给想转型产品经理的几点建议！,侠之大者,产品.架构 【公众号：侠之大者】,2019-11-15,1.1万,34,9,3,http://www.woshipm.com/pmd/3093565.html
一款好的产品，有哪些底层逻辑？,灰度认知社,,2019-11-15,1.2万,78,17,7,http://www.woshipm.com/pmd/3091404.html
产品经理方法论：如何进行需求定义？（一）,谢君翊,,2019-11-14,7260,27,10,2,http://www.woshipm.com/pmd/3076507.html
业务中台实战：需要怎样的产品经理？,半个金俗人,中台/B端产品经理,2019-11-14,7672,22,4,2,http://www.woshipm.com/pmd/2621657.html
B端产品经理的方法论,朱学敏,个人公众号：朱学敏,2019-11-14,3981,37,7,2,http://www.woshipm.com/pmd/3084324.html
数据产品经理，并不是数据 + 产品经理,人人都是产品经理,产品经理和运营的成长社区,2019-11-13,1.5万,104,14,5,http://www.woshipm.com/pmd/3083271.html
经验分享：产品新人快速上手工作的6个路线,产品经理的那点事儿,电商高级产品|公众号:产品经理的那点事儿,2019-11-13,1944,29,27,5,http://www.woshipm.com/pmd/3080352.html
要想干得好，做O2O必须向线下学习,Adam,"产品专家
公众号：倪老大胡说职场与成长",2019-11-13,2425,18,4,2,http://www.woshipm.com/pmd/3081130.html
什么是敏捷开发Scrum及其适用场景？,羊小双双,为小白产品经理分享实用资料  (同名企鹅号),2019-11-13,3045,20,2,1,http://www.woshipm.com/pmd/3082114.html
开发/运营/设计，转岗产品经理难不难呢？,熊不知,微信公众号：熊不知,2019-11-12,2158,9,4,2,http://www.woshipm.com/pmd/3074427.html
数据产品经理之图表设计,Eric,数据产品经理,2019-11-12,2197,44,3,0,http://www.woshipm.com/pmd/3004786.html
基于经验，总结B端产品经理产品思维,产品小思考,2B产品 公众号：产品小思考,2019-11-12,5688,45,9,1,http://www.woshipm.com/pmd/3077158.html
产品经理如何高效沟通表达？,舀一瓢风月,个人公众号：keen_not_king,2019-11-11,6605,98,35,8,http://www.woshipm.com/pmd/3070157.html
数据产品经理必备之SQL基础,Eric,数据产品经理,2019-11-11,6845,70,4,10,http://www.woshipm.com/pmd/3069029.html
如何进行有效需求分析？（二）,晓庄同学,公众号：晓庄同学产品笔记,2019-11-11,5887,34,5,7,http://www.woshipm.com/pmd/3052130.html
从9个小问题聊聊产品思维,王海,关注公众号看新文章：产品经理第七班,2019-11-08,1.1万,73,11,8,http://www.woshipm.com/pmd/3065754.html
产品经理玩狼人杀不务正业？,会飞的猪,公众号：刻意练习产品思维,2019-11-08,1672,10,4,3,http://www.woshipm.com/pmd/3064843.html
产品经理如何绘制状态流转图？,产品慎思录,公众号：产品慎思录,2019-11-08,1.1万,88,22,8,http://www.woshipm.com/pmd/3065572.html
支付产品经理入门（1）行业各角色分析,侠之大者,产品.架构 【公众号：侠之大者】,2019-11-08,2395,33,4,2,http://www.woshipm.com/pmd/2760789.html
突破B端产品经理困境——做ITBP,产品小李子,一枚进阶中的产品狗，公众号：产品小李子,2019-11-07,3789,30,12,0,http://www.woshipm.com/pmd/3056176.html
离职找工作，产品总监也忧愁,枯叶,公众号：枯叶咖啡馆,2019-11-06,1.1万,32,18,17,http://www.woshipm.com/pmd/3057437.html
让老板产品运营之间多一点相互理解,吴万俟,公众号吴万俟后台可以找到我,2019-11-06,3514,14,6,0,http://www.woshipm.com/pmd/3054347.html
产品经理的自我修炼（2）：三项核心能力,西湖渔歌,,2019-11-06,5360,35,3,0,http://www.woshipm.com/pmd/3056188.html
如何评估需求的可行性？,起风猪,同名产品公众号《起风猪》,2019-11-06,4030,25,8,0,http://www.woshipm.com/pmd/3050202.html
如何输出一份合格的产品方案？注意这6个方面,大白随笔,公众号：大白产品随笔（ID：dabaixuetang）,2019-11-05,5014,42,11,2,http://www.woshipm.com/pmd/3048603.html
升级的B端业务分析框架,杨堃,《决胜B端》作者,2019-11-05,1.4万,107,10,12,http://www.woshipm.com/pmd/3053893.html
产品必修课：结构化思维,水上木偶,一个懒惰的产品设计师,2019-11-05,2754,39,4,4,http://www.woshipm.com/pmd/2254165.html
产品经理：需求变更，我太难了！,熊不知,微信公众号：熊不知,2019-11-05,1.2万,54,15,9,http://www.woshipm.com/pmd/3052275.html
如何进行有效需求分析？（一）,晓庄同学,公众号：晓庄同学产品笔记,2019-11-05,1.5万,119,24,9,http://www.woshipm.com/pmd/3052124.html
中后台产品经理的业务调研，应该调研什么？,Caroline.,一个美女,2019-11-05,9026,43,19,1,http://www.woshipm.com/pmd/3049692.html
产品经理需知晓：弃权也是决策,枯叶,公众号：枯叶咖啡馆,2019-11-05,6556,6,2,1,http://www.woshipm.com/pmd/3052165.html
3-5岁产品经理的快速成长路径,王海,关注公众号看新文章：产品经理第七班,2019-11-05,6936,22,2,0,http://www.woshipm.com/pmd/3048141.html
广告投放平台（DSP）产品经理工作的几个重点,orca,AdBright产品经理,2019-11-05,5358,48,4,5,http://www.woshipm.com/pmd/3049528.html
告别撕逼，产品经理的沟通指南,东东方,不定期分享产品心得。公众号ID：UnknownPM,2019-11-05,1267,20,4,0,http://www.woshipm.com/pmd/3051759.html
4个方法，教你快速了解一个行业,Adam,"产品专家
公众号：倪老大胡说职场与成长",2019-11-05,4651,43,9,5,http://www.woshipm.com/pmd/2952170.html
产品人的灵魂是什么？,会飞的猪,公众号：刻意练习产品思维,2019-11-04,926,4,4,1,http://www.woshipm.com/pmd/3046229.html
毕业2年，我决定做产品经理,小刘,,2019-11-02,1.2万,44,14,20,http://www.woshipm.com/pmd/2719497.html
从数独说起，聊聊我对产品思维的思考,问梦孤独,一个学子,2019-11-02,9383,17,12,2,http://www.woshipm.com/pmd/2925382.html
产品经理怎样写后台系统的交互说明？,Caroline.,一个美女,2019-11-02,5576,65,20,4,http://www.woshipm.com/pmd/3040471.html
做好产品VS做好产品的商业模式,大力哥呀,产品经理,2019-11-01,4241,24,2,2,http://www.woshipm.com/pmd/3041460.html
3个步骤，让你做好项目管理,东东方,不定期分享产品心得。公众号ID：UnknownPM,2019-11-01,5912,26,5,0,http://www.woshipm.com/pmd/3041433.html
产品经理的“杠杆思维”：找到支点，撬动商业帝国,PM Walker,公众号“PM Walker”,2019-11-01,2885,11,3,2,http://www.woshipm.com/pmd/3037562.html
产品经理的职场后期：让工作来找你,枯叶,公众号：枯叶咖啡馆,2019-10-31,5595,33,11,3,http://www.woshipm.com/pmd/3031805.html
资深产品经理的产品架构技能：不断深入思考，进行逻辑分析,李杭,暂无,2019-10-31,7037,71,9,10,http://www.woshipm.com/pmd/3031903.html
产品经理面试题：井盖为什么是圆的？,李涛,-1岁PM，求职分享/面经公众号：柠檬two,2019-10-31,8094,34,10,22,http://www.woshipm.com/pmd/3032331.html
产品经理需知晓：决策的意义（二）,枯叶,公众号：枯叶咖啡馆,2019-10-30,5102,29,6,2,http://www.woshipm.com/pmd/3030863.html
如何输出一份高质量PRD？,John,微信公众号：产品狗聚集地,2019-10-30,1.5万,163,39,6,http://www.woshipm.com/pmd/3029412.html
我的产品经理能力模型和成长之路,PM熊叔,帮助团队发布正确产品给用户的人,2019-10-29,1.5万,170,49,26,http://www.woshipm.com/pmd/3024508.html
互金产品经理要不要转行？,克拉,公众号ITFINPM，专注金融科技,2019-10-29,2981,8,6,0,http://www.woshipm.com/pmd/3021516.html
B端产品需求文档怎么写？,互联浩斯,公众号：互联浩斯。（云计算存储PM）,2019-10-28,1.4万,104,15,5,http://www.woshipm.com/pmd/3020484.html
支付体系（一）：关于支付产品经理的思考,花开不败,个人公众号涵小仙女，欢迎添加。,2019-10-28,9144,66,5,5,http://www.woshipm.com/pmd/3020544.html
当产品经理在卖场做产品测试……,大力哥呀,产品经理,2019-10-28,9500,18,12,9,http://www.woshipm.com/pmd/3020217.html
3个关键点，聊聊我对产品思维的分析与思考,王晗陵,公众号：设计意志,2019-10-28,4208,32,6,2,http://www.woshipm.com/pmd/3017483.html
你的产品哲学，了解一下？,独步天涯客,创业者，产品汪，积极上进的热血青年！,2019-10-28,667,2,1,0,http://www.woshipm.com/pmd/3016323.html
你们公司需要怎样的产品经理？,晓庄同学,公众号：晓庄同学产品笔记,2019-10-28,3650,34,16,9,http://www.woshipm.com/pmd/3019974.html
4个步骤，让你完成行业分析,东东方,不定期分享产品心得。公众号ID：UnknownPM,2019-10-25,1.7万,218,41,11,http://www.woshipm.com/pmd/3013760.html
产品经理之「种子」挑选和栽培,于振国,高级产品经理，微信公众号：hssj_yzg,2019-10-25,3.6万,24,7,1,http://www.woshipm.com/pmd/3013798.html
四步成为人工智能产品经理,白白说话,医药行业，AI产品经理。数据科学爱好者。,2019-10-25,3275,41,2,8,http://www.woshipm.com/pmd/2780953.html
作为一名毕业一年的京东产品小白，我眼中的产品和需求是什么？,不二越齐,95后理工男，京东18届产品经理。,2019-10-24,3550,32,15,5,http://www.woshipm.com/pmd/3008540.html
AI产品经理必修课：机器学习算法入门,Alan,公众号AIPM1001,2019-10-24,6568,27,15,0,http://www.woshipm.com/pmd/2942899.html
对产品经理来说，这3个问题需要思考,白白说话,医药行业，AI产品经理。数据科学爱好者。,2019-10-24,6631,31,7,1,http://www.woshipm.com/pmd/2780922.html
初入职产品经理如何开展工作？,神奇海螺,在线教育产品经理，五子棋业余大师,2019-10-24,6058,73,26,14,http://www.woshipm.com/pmd/3006520.html
产品经理，你为什么对需求细节不敏感？,产品慎思录,公众号：产品慎思录,2019-10-24,3517,41,19,3,http://www.woshipm.com/pmd/3009475.html
B端产品经理的金字塔能力模型,产品小思考,2B产品 公众号：产品小思考,2019-10-24,1.3万,152,46,26,http://www.woshipm.com/pmd/3008902.html
产品经理需知晓：决策的意义,枯叶,公众号：枯叶咖啡馆,2019-10-23,7698,19,3,2,http://www.woshipm.com/pmd/3005783.html
To B产品经理，如何突破职业瓶颈？,陈文中,公众号：秀肌肉的码蚁，个人微信：51959516,2019-10-23,3960,26,3,1,http://www.woshipm.com/pmd/3004878.html
B端产品经理必修课：组织架构设计与销售管理,阿猫阿狗,微信公众号：阿猫阿狗的产品经理日记,2019-10-23,4747,27,3,6,http://www.woshipm.com/pmd/3004756.html
To B项目中，你需要一支游骑兵,林壮壮,腾讯高级产品经理 | 母众号：健壮的大姐姐,2019-10-23,4467,21,7,5,http://www.woshipm.com/pmd/3003503.html
进大厂必读：搜狐—产品经理主观题解析,PM 韭菜,策略产品经理,2019-10-23,3902,27,7,4,http://www.woshipm.com/pmd/3001056.html
想转型产品经理，如何成功通过面试？,会飞的猪,公众号：刻意练习产品思维,2019-10-22,2049,17,3,2,http://www.woshipm.com/pmd/3000501.html
进大厂必读：网易—产品经理主观题解析,PM 韭菜,策略产品经理,2019-10-22,1万,39,10,5,http://www.woshipm.com/pmd/3000444.html
3招掌握AI与大数据产品经理的能力,LineLian,AI与数智一体化产品，个人微信 firstbodytm,2019-10-22,1万,35,13,2,http://www.woshipm.com/pmd/3000853.html
B端产品经理与业务方的相爱相恨,杨堃,《决胜B端》作者,2019-10-22,4272,24,4,8,http://www.woshipm.com/pmd/2998404.html
