title,author,author_des,date,views,loves,zans,comment_num,url
土木工程转行互联网的心得体会,撒野的氧气,个人公众号：产品汪的成长路,2020-03-06,642,0,3,0,http://www.woshipm.com/pmd/3467205.html
项目管理：产品经理如何进行项目管理？,撒野的氧气,个人公众号：产品汪的成长路,2020-03-06,1222,7,3,0,http://www.woshipm.com/pmd/3475323.html
如何用产品思维提升通勤质量？,烧包鹿,公众号：产品经理小助理,2020-03-05,369,0,2,0,http://www.woshipm.com/pmd/3469946.html
3个维度，解读B端产品该如何管理产品团队？,陈爱雯,,2020-03-05,2922,10,2,2,http://www.woshipm.com/pmd/3463973.html
产品经理的职业病，都有哪些？,jameson,,2020-03-05,2583,3,4,0,http://www.woshipm.com/pmd/3469603.html
产品经理成长之路：完成比完美更重要,齐进取,北京邮电大学研二狗，在线卑微学习中。,2020-03-04,5963,17,13,3,http://www.woshipm.com/pmd/3453537.html
产品经理面试前该准备的六个问题,jiongoogle,专注于产品团队管理,2020-03-04,4836,14,7,4,http://www.woshipm.com/pmd/3451155.html
从0到1做产品，究竟对PM的要求有什么不同,慕斯姑娘,微信号musiguniang  公众号“产品那些年”,2020-03-04,2189,2,1,0,http://www.woshipm.com/pmd/3450403.html
B端产品经理的通用工作流程,小Q聊产品,《从需求到产品》书籍作者,2020-03-03,807,3,0,0,http://www.woshipm.com/pmd/3449873.html
产品新人如何远离“打杂”工作？,撒野的氧气,个人公众号：产品汪的成长路,2020-03-03,3655,10,2,0,http://www.woshipm.com/pmd/3457642.html
出色的产品经理应具备的四点特质,Mr.lee,,2020-03-03,3317,9,3,0,http://www.woshipm.com/pmd/3455316.html
看完这几步，入职新公司快速上手新产品,时光,创业一周刊专栏作者公号：时光遇见生活,2020-03-03,505,2,0,0,http://www.woshipm.com/pmd/3451536.html
复盘 | 一次失败项目汇报思考,产品跃迁,,2020-03-03,2802,6,1,0,http://www.woshipm.com/pmd/3452757.html
想成长为优秀产品leader，这10大心法你要收好了,司马特小队,专注B端产品， 订阅号：司马特小分队,2020-03-02,8405,33,12,3,http://www.woshipm.com/pmd/3449565.html
他们是提需求的，不是做产品的,菜根乱谭,混迹在技术、产品、运营等领域。,2020-03-02,665,2,1,0,http://www.woshipm.com/pmd/3448141.html
需求改来改去，高手和菜鸟究竟有什么不同？,饭大官人,,2020-03-02,5972,15,8,1,http://www.woshipm.com/pmd/3342780.html
需求分析的3个层次,余子申,做过产品的运营，Refind18,2020-03-02,8025,13,10,1,http://www.woshipm.com/pmd/3450775.html
细分市场下，金融产品怎么做数字化匹配？,兔小吱,,2020-02-29,1.3万,10,2,0,http://www.woshipm.com/pmd/3446569.html
业务思维，对产品经理真的重要吗？,伍德安思壮,互联网产品，公众号《溪境学堂》作者,2020-02-28,1.9万,26,4,4,http://www.woshipm.com/pmd/3354941.html
产品经理打怪升级之旅：关于职级晋升的一些方法和技巧（上篇）,PM番茄子,,2020-02-28,6312,14,8,1,http://www.woshipm.com/pmd/3443627.html
产品经理常见的几个认知错误（中）,打酱油的熊,公众号：打酱油的白熊 欢迎加入一起学习,2020-02-28,2695,6,4,0,http://www.woshipm.com/pmd/3445105.html
10 年产品人的成长故事,四月,分享产品，记录成长。公众号：四月说产品,2020-02-28,4433,24,15,10,http://www.woshipm.com/pmd/3438353.html
以趣头条为例，拆解单用户价值模型,何其多多,手机行业AI产品汪（公众号：何其多多）,2020-02-28,3383,8,2,4,http://www.woshipm.com/pmd/3432728.html
B端产品，如何平衡通用化和个性化？,司马特小队,专注B端产品， 订阅号：司马特小分队,2020-02-28,3209,14,7,1,http://www.woshipm.com/pmd/3444667.html
我的B端产品经理工作流,vitamin,更多内容，请关注公众号：皮酱叨逼叨,2020-02-28,1.1万,185,42,33,http://www.woshipm.com/pmd/3438644.html
产品需求：“重要”和“紧急”，到底先做哪个？,曙Ouba,微信公众号同名 / 专注产品思维成长,2020-02-28,4137,9,13,7,http://www.woshipm.com/pmd/3438216.html
产品反思：团队和组织是一切的基石,南村小付,,2020-02-27,7701,14,10,1,http://www.woshipm.com/pmd/3434244.html
复盘陌陌面试，拆解策略产品的面试考察点,随心将夜,备战春招ing，分享有价值的思考体验,2020-02-27,2301,13,3,2,http://www.woshipm.com/pmd/3349063.html
外包产品经理如何华丽转身？,司马特小队,专注B端产品， 订阅号：司马特小分队,2020-02-27,2201,8,2,1,http://www.woshipm.com/pmd/3435067.html
产品经理如何搞定“不讲理的需求”？,唐韧,《产品经理必懂的技术那点事儿》作者，公众号：唐韧,2020-02-27,3812,12,7,1,http://www.woshipm.com/pmd/3430876.html
如何提高产品经理的智慧等级？,奇文天翔,某一线互联网公司金融子业务负责人,2020-02-27,2530,8,0,0,http://www.woshipm.com/pmd/3431029.html
在创业公司做产品，是种怎样的体验？,明天上线,这个需求很简单，怎么实现我不管！,2020-02-27,1889,3,4,2,http://www.woshipm.com/pmd/3434022.html
5个关键，详解H5页面测试要点,彭青梅,,2020-02-27,1646,9,1,0,http://www.woshipm.com/pmd/3430511.html
产品经理的王牌思维：转换成本,温清河,公众号：温清河,2020-02-26,6140,7,1,0,http://www.woshipm.com/pmd/3431686.html
论产品经理的自我修炼（5）：项目管理的要诀,西湖渔歌,,2020-02-26,751,1,2,0,http://www.woshipm.com/pmd/3430530.html
B端产品经理：如何做好新业务的需求调研？,南枫,,2020-02-26,5651,9,3,4,http://www.woshipm.com/pmd/3430012.html
ROI模型下，产品项目成功的三大关键能力,独步天涯客,创业者，产品汪，积极上进的热血青年！,2020-02-26,2051,3,1,0,http://www.woshipm.com/pmd/3068942.html
需求调研会议的常见问题,瓜子,,2020-02-26,1785,7,0,1,http://www.woshipm.com/pmd/961199.html
掌握“影响分析思维”，解决产品节点缺陷,iCheer,,2020-02-25,6681,8,4,1,http://www.woshipm.com/pmd/3422945.html
6大构成，解析产品工作方法论,独步天涯客,创业者，产品汪，积极上进的热血青年！,2020-02-25,2534,9,2,4,http://www.woshipm.com/pmd/3421328.html
迭代总延期，产品经理怎么办？,王掌柜,,2020-02-25,2520,16,5,2,http://www.woshipm.com/pmd/3422050.html
洞察——产品战略的基础,素诉,用户体验至上，商业价值为真,2020-02-25,1816,2,1,0,http://www.woshipm.com/pmd/3424383.html
野蛮生长的B端产品，如何挖掘新需求源？,青木,不知名产品人，公众号：青木产品笔记,2020-02-25,1884,2,1,0,http://www.woshipm.com/pmd/3422838.html
做 ToB 产品，产品经理需要怎么做？,Mr.cat,,2020-02-24,1088,5,2,0,http://www.woshipm.com/pmd/3426014.html
B端产品如何做好数据埋点？,司马特小队,专注B端产品， 订阅号：司马特小分队,2020-02-24,4027,28,10,1,http://www.woshipm.com/pmd/3418056.html
万字解析：如何提前成为高级PM？,臣有bug揍,写作如同一道光，照到不被看见的事物上。,2020-02-24,6436,47,12,9,http://www.woshipm.com/pmd/2207364.html
疫情期间，为什么你的订单到货那么慢？,DearNicole,订阅：“＼＼中台碎碎念＼＼“,2020-02-24,3895,4,2,3,http://www.woshipm.com/pmd/3419008.html
怎样成为卓越的产品经理？,莫志强,唯品会高级产品经理,2020-02-24,2949,13,9,1,http://www.woshipm.com/pmd/3419608.html
产品讲技术 | 带你看懂什么是计算机视觉（二）,喧闹丶,互联网爱好者,2020-02-24,271,3,3,0,http://www.woshipm.com/pmd/3419399.html
产品新人没有完整项目经验？这篇文章帮你打开思路,刀哥,公众号：刀哥说,2020-02-23,1.4万,132,33,1,http://www.woshipm.com/pmd/3412636.html
算法产品，5“W”1“H”,B.J. Shen,,2020-02-23,8561,6,6,1,http://www.woshipm.com/pmd/3401974.html
产品经理如何面对一句话需求？,申悦,36氪产品总监，公众号：pmboxs，微信：s2dongman，欢迎交流,2020-02-23,1万,44,48,16,http://www.woshipm.com/pmd/3414153.html
AI时代，产品经理如何成功应用人工智能？,PM熊叔,帮助团队发布正确产品给用户的人,2020-02-21,6794,15,5,2,http://www.woshipm.com/pmd/3405922.html
靠谱PM的方法论：全面&深入思考,大鱼,7年产品汪，公众号：大鱼成长社,2020-02-21,1125,11,0,2,http://www.woshipm.com/pmd/3404857.html
需求分析：不做需求的传声筒,瓜子,,2020-02-21,5253,26,10,0,http://www.woshipm.com/pmd/2349785.html
产品经理，需要一些必备素质,花开不败,个人公众号涵小仙女，欢迎添加。,2020-02-20,1万,48,20,4,http://www.woshipm.com/pmd/3409515.html
深度解析 | 俞军的产品方法论,特立独行的Eric,公众号：一只特立独行的Eric,2020-02-20,1万,90,25,3,http://www.woshipm.com/pmd/3402762.html
产品经理能力模型二三话,善宝橘,桃李不言，下自成蹊。微信公众号：善宝橘,2020-02-20,5863,37,6,0,http://www.woshipm.com/pmd/3398413.html
产品经理，请像创造者一样思考,陈宿啊,小开始，大梦想。公众号：陈宿啊。,2020-02-19,7603,25,14,9,http://www.woshipm.com/pmd/3405334.html
项目管理工作对于产品经理，是杂活吗？,橘子,公众号：橘子周思录,2020-02-19,4377,8,2,1,http://www.woshipm.com/pmd/3403649.html
产品经理，别再只会说“需求就是人们想要的”了,顾淮,做好产品，不只是产品经理,2020-02-19,4620,43,11,0,http://www.woshipm.com/pmd/3397524.html
To G不易：招投标暂停了，产品经理还能干点什么,稀奇星球,转载请联系：xiqiplanet@163.com,2020-02-18,6336,13,2,3,http://www.woshipm.com/pmd/3402037.html
需求直通率：产品团队提升效率的一个重要绩效指标,陈加兴,研究平台战略、SaaS与组织效能。,2020-02-18,5943,4,0,0,http://www.woshipm.com/pmd/3401822.html
转做业务型产品经理后的3点体会：深入业务、平衡利益、跑通流程,大力哥呀,产品经理,2020-02-18,5615,11,6,0,http://www.woshipm.com/pmd/3401220.html
需求ROI评估：B端产品经理怎么做需求优先级排序？,王掌柜,,2020-02-18,5709,11,2,0,http://www.woshipm.com/pmd/3400568.html
对于“项目管理”的一些理解,叫我阿逸,分享我的产品想法、故事；公众号：人云逸云,2020-02-18,5120,7,20,0,http://www.woshipm.com/pmd/3400324.html
产品经理，你要如何先学会生存？,新夸克,硬件产品总监，robo1234,2020-02-18,4658,21,7,0,http://www.woshipm.com/pmd/3400154.html
经验分享：如何做好产品可行性分析？,产品经理的那点事儿,电商高级产品|公众号:产品经理的那点事儿,2020-02-18,5511,22,10,2,http://www.woshipm.com/pmd/3399425.html
产品经理2020进阶指南：如何养成你开挂的职业技能树？,中信出版集团商业社,,2020-02-17,5616,25,7,3,http://www.woshipm.com/pmd/3393576.html
谣言问题，如何用产品思维来解决？,IMPM,公主号：一个奋青,2020-02-17,3969,28,9,13,http://www.woshipm.com/pmd/3396422.html
产品大神俞军：给产品经理的前五年成长建议,中信出版集团商业社,,2020-02-16,1.5万,83,28,3,http://www.woshipm.com/pmd/3393658.html
如何利用AI语义分析，做产品需求分析（1）,陈迪 Derek,"陈迪 Derek, 海归产品运营， 运营总监",2020-02-15,1.1万,6,2,0,http://www.woshipm.com/pmd/3395380.html
从一道面试题说开来，聊聊产品经理的几个基本素质,壹百度,公众号：倒退集，不定期分享产品干货,2020-02-14,1.4万,36,12,3,http://www.woshipm.com/pmd/3395676.html
以教育行业为例，教产品经理如何做行业分析,koi,在知识的海洋游泳的产品狗,2020-02-14,1.2万,64,4,9,http://www.woshipm.com/pmd/3395603.html
如何更好地做需求决策，避免返工？,于言某,微信公众号“于言某”,2020-02-14,2144,19,2,3,http://www.woshipm.com/pmd/3393657.html
2个流程+1个思路，让产品需求策划更清晰,曙Ouba,微信公众号同名 / 专注产品思维成长,2020-02-14,5690,42,9,0,http://www.woshipm.com/pmd/3393453.html
用户需求：依附于用户，存在于场景,Wcof,想做产品、更幸福，不想做产品经理,2020-02-14,2544,9,2,0,http://www.woshipm.com/pmd/3389780.html
谈谈SaaS产品、后端产品和B端产品的产品关注点,唧唧歪歪pm,公众号：jjyypm,2020-02-14,3287,8,1,2,http://www.woshipm.com/pmd/3391275.html
常见的非功能性需求和应对方式,Esther,人人都是产品经理内容运营团队,2020-02-14,2859,10,3,0,http://www.woshipm.com/pmd/3391140.html
一个输入框你要做一周？,Esther,人人都是产品经理内容运营团队,2020-02-13,9386,60,18,10,http://www.woshipm.com/pmd/3391148.html
数据产品经理，该如何搭建数据平台？,Lens-J,,2020-02-13,5507,15,3,0,http://www.woshipm.com/pmd/3390548.html
以SaaS产品为例，通过场景和价值判断需求,客者Aven,公众号：超越产品思维,2020-02-13,3492,16,5,0,http://www.woshipm.com/pmd/3388524.html
产品经理，你不能只会画原型,明天上线,这个需求很简单，怎么实现我不管！,2020-02-12,3015,11,6,1,http://www.woshipm.com/pmd/3383979.html
产品经理的自我修炼（4）：如何培养产品设计与规划能力？,西湖渔歌,,2020-02-12,3681,4,2,0,http://www.woshipm.com/pmd/3385431.html
需求方法论（2）：需求的分析、验证与排序,橘钻,錆びついたマシンガンで今を撃ち抜こう,2020-02-12,2700,16,4,3,http://www.woshipm.com/pmd/3375529.html
复盘总结：从0到1，企业微信小程序开发11步走,失隅,产品经理/需求分析师,2020-02-11,5932,13,5,0,http://www.woshipm.com/pmd/3379410.html
功能优化越做越差？你需要警惕这个问题,司马特小队,专注B端产品， 订阅号：司马特小分队,2020-02-11,5155,13,7,5,http://www.woshipm.com/pmd/3382648.html
用户故事脑图，帮你快速理解新产品/新需求,张名扬,,2020-02-11,5037,23,9,1,http://www.woshipm.com/pmd/3382745.html
需求方法论（1）：需求的理解/来源/挖掘/记录,橘钻,錆びついたマシンガンで今を撃ち抜こう,2020-02-11,6249,30,15,3,http://www.woshipm.com/pmd/2951465.html
致5岁以下的产品经理：学会从产品工具人阶段升级,枯叶,公众号：枯叶咖啡馆,2020-02-11,9274,104,18,7,http://www.woshipm.com/pmd/3383423.html
参加完微信付费阅读内测，我有3点感受,唐韧,《产品经理必懂的技术那点事儿》作者，公众号：唐韧,2020-02-11,2339,2,1,0,http://www.woshipm.com/pmd/3381734.html
产品经理常见的几个认知错误（上）,打酱油的熊,公众号：打酱油的白熊 欢迎加入一起学习,2020-02-11,3549,44,8,2,http://www.woshipm.com/pmd/3382892.html
需求调研的第一步：项目背景调研,瓜子,,2020-02-10,6966,13,6,0,http://www.woshipm.com/pmd/3376448.html
成为搜索产品经理（2）：认识网络爬虫,一颗西兰花,Be Relentlessly Resourceful,2020-02-10,754,5,1,5,http://www.woshipm.com/pmd/3378458.html
产品经理如何管理产品策略和优先级？,vivi,,2020-02-10,5174,4,1,1,http://www.woshipm.com/pmd/3379205.html
产品经理面试题 | 面试结束时常见的8个问题,L先生,上海|产品经理,2020-02-10,4519,33,7,0,http://www.woshipm.com/pmd/3376108.html
产品经理10大基础技能（2）：读透模型,LineLian,AI与数智一体化产品，个人微信 firstbodytm,2020-02-10,8289,41,16,0,http://www.woshipm.com/pmd/3379622.html
高阶产品经理：用系统解决问题,产品慎思录,公众号：产品慎思录,2020-02-09,1.1万,20,7,3,http://www.woshipm.com/pmd/3378133.html
决策——产品经理的核心竞争力,素诉,用户体验至上，商业价值为真,2020-02-07,5599,13,1,0,http://www.woshipm.com/pmd/3372399.html
SaaS系统业务调研复盘：以美容院信息管理系统为例,客者Aven,公众号：超越产品思维,2020-02-07,2992,30,9,1,http://www.woshipm.com/pmd/3371834.html
策略产品经理如何发现问题？（上）,海燕是只蠢猫,做自己的产品经理,2020-02-07,2342,16,2,1,http://www.woshipm.com/pmd/3370401.html
产品经理如何进行需求管理？,koi,在知识的海洋游泳的产品狗,2020-02-07,3881,14,4,0,http://www.woshipm.com/pmd/3369691.html
产品学习札记03：我对“潜意识”的思考,兮兮,公众号:孤身旅人（ID：gushenlvren）,2020-02-06,3979,2,0,0,http://www.woshipm.com/pmd/3369855.html
产品进化论与实战法则,唐涛,,2020-02-06,4717,5,6,2,http://www.woshipm.com/pmd/3362358.html
怎样做出高质量需求决策？找到推动产品增长的需求点,莫志强,唯品会高级产品经理,2020-02-06,4425,11,10,7,http://www.woshipm.com/pmd/3366678.html
产品经理2020破局点（一）：从宏观角度看增长思维,淘乐的生活,5年产品+运营经验，斜杠青年，持续增长中~,2020-02-05,5493,5,3,0,http://www.woshipm.com/pmd/3361513.html
产品经理面试题 | 需求和项目管理的8个问题,L先生,上海|产品经理,2020-02-05,7498,61,11,4,http://www.woshipm.com/pmd/3363936.html
模仿产品功能时，你还能想些什么？,三川梦境,Rethink,2020-02-05,8054,25,12,2,http://www.woshipm.com/pmd/3360437.html
产品经理，警惕你的能力陷阱！,李杭,暂无,2020-02-05,2850,10,2,0,http://www.woshipm.com/pmd/3361130.html
新世代下，关于产品需求新趋势的思考,markzou,,2020-02-05,2048,1,3,0,http://www.woshipm.com/pmd/3345957.html
做一个产品，8+3+4+5,Miracle,专注做产品,2020-02-05,5942,44,43,3,http://www.woshipm.com/pmd/3359162.html
产品经理方法论：通过卡诺模型进行需求分类和优先级排序,我是开水,京东金融产品经理，个人公众号 liaochanpin,2020-02-05,2353,16,4,0,http://www.woshipm.com/pmd/3336090.html
初级SaaS产品经理养成记,佛系少年,2019届初级PM，产品狂爱者。,2020-02-05,483,3,0,0,http://www.woshipm.com/pmd/3360685.html
产品经理懂点技术之：4K/8K,iCheer,,2020-02-05,2294,8,0,3,http://www.woshipm.com/pmd/3360870.html
产品思维：产品的宏观与微观世界（上）,西特张,产品经理、ACP、PMP、ScrumMaster,2020-02-04,5231,11,4,0,http://www.woshipm.com/pmd/3361622.html
不想做需求的搬运工，B端产品经理怎么办？,王掌柜,,2020-02-04,5287,21,10,0,http://www.woshipm.com/pmd/3360317.html
如何定义一场细致的需求评审？,老虎~色,,2020-02-04,2325,11,0,0,http://www.woshipm.com/pmd/3358015.html
一个老产品的心路历程,燕然未勒,,2020-02-04,2699,7,9,0,http://www.woshipm.com/pmd/3355426.html
关于在线少儿编程的需求分析,JunjieXian,立志做一名伟大的产品经理,2020-02-03,4780,28,13,9,http://www.woshipm.com/pmd/3337723.html
头部产品经理的 OPPORTUNITY 素质模型,榴芒小丸子,人人都是产品经理内容运营,2020-02-03,4187,8,4,1,http://www.woshipm.com/pmd/3360985.html
转行产品经理一年多的避雷心得,SenYi,从0到1打磨自己，从猿猴变成猎狗,2020-02-03,3792,16,2,8,http://www.woshipm.com/pmd/1727944.html
产品经理，你的用户流失了怎么办？,接地气的陈老师,公众号『接地气学堂』,2020-02-03,3051,1,0,0,http://www.woshipm.com/pmd/3353036.html
产品团队的批判性思维：如何通过合理的决策带来合理的结果？,PM熊叔,帮助团队发布正确产品给用户的人,2020-02-03,2106,6,3,0,http://www.woshipm.com/pmd/3350137.html
30秒说清你的需求解决方案有多重要？,天朝贰汪,"公众号“天朝贰汪”
ID：hello2wang",2020-02-03,1792,4,1,0,http://www.woshipm.com/pmd/3348513.html
实战经验分享：产品经理如何和UED团队高效沟通？,B.J. Shen,,2020-02-03,2011,4,2,0,http://www.woshipm.com/pmd/3353246.html
我理解的产品核心价值观,产品小奥,产品科学化和营销科学化的积极推动者,2020-01-31,1.3万,48,17,4,http://www.woshipm.com/pmd/3348568.html
产品经理晋级产品专家必跨的14道台阶,张杨俊恒,,2020-01-29,1.7万,103,25,22,http://www.woshipm.com/pmd/3345612.html
一位产品经理的2020年新年计划,佳佳原创,,2020-01-28,2.3万,123,39,19,http://www.woshipm.com/pmd/3346620.html
2020年，产品经理的核心竞争力在哪里？,蚂蚁先生,K12在线教育产品经理，公众号【增长笔记】,2020-01-26,1.7万,65,28,11,http://www.woshipm.com/pmd/3346931.html
我所理解的需求文档,Isaac,取势明道优术,2020-01-26,1.5万,37,11,5,http://www.woshipm.com/pmd/3346373.html
我复盘了自己的工作，总结了这个跨境支付产品经理的成长经验给你,锅包肉,专注跨境金融行业,2020-01-24,9463,22,4,0,http://www.woshipm.com/pmd/2683244.html
关于思考、学习及实践的思考，希望能对你有用,Isaac,取势明道优术,2020-01-24,8091,27,6,4,http://www.woshipm.com/pmd/3343740.html
产品经理懂点技术：什么是前后端，两者如何分工？,iCheer,,2020-01-22,1.2万,52,16,3,http://www.woshipm.com/pmd/3341163.html
产品经理懂点技术：前后端是如何“分家”的？,iCheer,,2020-01-21,1.2万,68,29,7,http://www.woshipm.com/pmd/3342034.html
2020年产品经理脱坑指南,然阿姨,公号：然阿姨的产品课，就职于腾讯、瓜子等,2020-01-21,1.1万,28,10,5,http://www.woshipm.com/pmd/3341931.html
从职位定义入手，认识「产品经理」的本质,Daniel,互联网产品经理，《见识之旅》主理人,2020-01-21,2121,3,0,0,http://www.woshipm.com/pmd/3343638.html
用经济学思维做产品，从3大流程说起,路路有维,,2020-01-20,1136,4,1,0,http://www.woshipm.com/pmd/3340412.html
产品经理面试题 | 常见的产品知识大汇总,L先生,上海|产品经理,2020-01-20,3949,58,10,1,http://www.woshipm.com/pmd/3339033.html
产品经理懂点技术：什么是https，与http有什么区别,iCheer,,2020-01-20,9155,66,25,10,http://www.woshipm.com/pmd/3335426.html
跳槽前，你想好自己的职业发展规划了吗？,陆子樊,某证券产品负责人，90后工作5年,2020-01-20,5512,28,13,4,http://www.woshipm.com/pmd/3331140.html
成熟的产品思维，让产品经理职业生涯走得更远,十八线产品,个人公众号:十八线产品，欢迎关注,2020-01-20,5524,22,7,2,http://www.woshipm.com/pmd/3338363.html
对标腾讯产品经理能力模型，你还差哪几点？,老王指南,,2020-01-20,8619,91,16,7,http://www.woshipm.com/pmd/3338395.html
产品经理必须掌握的五个心理学原理,Kris,产品汪，公众号 Kris产品成长之路,2020-01-19,4506,33,2,0,http://www.woshipm.com/pmd/3337405.html
实操干货分享：B端硬件产品如何做行业分析&竞品分析？,Smile,关注“互联网+”智能硬件行业发展,2020-01-17,5686,40,11,4,http://www.woshipm.com/pmd/3301527.html
产品经理10大基础技能（1）：读透SQL,LineLian,AI与数智一体化产品，个人微信 firstbodytm,2020-01-17,9827,70,17,3,http://www.woshipm.com/pmd/3332065.html
经典模型第一讲：冰山模型建立自我认知,LS邋遢道人,,2020-01-17,2329,14,6,1,http://www.woshipm.com/pmd/3327559.html
一个B端产品2019快速成长的几个秘诀,vitamin,更多内容，请关注公众号：皮酱叨逼叨,2020-01-16,7186,32,16,12,http://www.woshipm.com/pmd/3330697.html
PRD到底该怎么写？更全面的文档范例来了,刀哥,公众号：刀哥说,2020-01-16,1.7万,217,43,24,http://www.woshipm.com/pmd/3327770.html
5个方面，聊聊B端需求管理方式,珂遇不可求,,2020-01-16,7262,24,4,4,http://www.woshipm.com/pmd/2797282.html
产品经理需了解的架构图/结构图知识,莉莉妮特,公众号：产品和运营日常,2020-01-16,7723,73,6,1,http://www.woshipm.com/pmd/3325209.html
产品经理：如何拥有自己的产品方法论？,彬,喜欢读书与分享，公众号“有个思享”,2020-01-16,3574,21,9,2,http://www.woshipm.com/pmd/3325596.html
撰写PRD之用户体验五要素篇,产品小白,,2020-01-15,6632,93,4,0,http://www.woshipm.com/pmd/3319375.html
产品经理如何让自己变得更值钱？,司马特小队,专注B端产品， 订阅号：司马特小分队,2020-01-15,9520,44,14,7,http://www.woshipm.com/pmd/3323051.html
回顾2019年，提升自己才是王道,Rock Lee,在运营界浪迹了大半个青春的不知名精英,2020-01-15,4413,7,11,8,http://www.woshipm.com/pmd/3322240.html
人人都是合作伙伴，总有人帮你定位,墨饕,网络营销人 | 心理咨询师,2020-01-15,2900,3,4,0,http://www.woshipm.com/pmd/3321002.html
产品经理学习之路：突破认知框架，洞悉事物本质,彬,喜欢读书与分享，公众号“有个思享”,2020-01-15,3763,17,10,2,http://www.woshipm.com/pmd/3318567.html
行业调研的这些关键点，你注意到了吗？,Carlos-梦,,2020-01-15,5066,113,19,7,http://www.woshipm.com/pmd/3322391.html
工作方法论：怎样做需求优先级评估？,我是开水,京东金融产品经理，个人公众号 liaochanpin,2020-01-15,2457,21,4,4,http://www.woshipm.com/pmd/3318912.html
产品认知的U型曲线：带你学会产品分析,岳小鱼,更多产品思考，欢迎关注微信公众号：岳小鱼,2020-01-14,1.1万,157,57,25,http://www.woshipm.com/pmd/3317387.html
如何利用数据，证明新业务的可行性？,接地气的陈老师,公众号『接地气学堂』,2020-01-14,5875,20,7,4,http://www.woshipm.com/pmd/3320982.html
内向性格的人，也可以做好产品经理,然阿姨,公号：然阿姨的产品课，就职于腾讯、瓜子等,2020-01-14,6932,15,11,6,http://www.woshipm.com/pmd/3314039.html
从产品视角看《佐藤可士和的超级整理术》,老王指南,,2020-01-14,2608,10,2,0,http://www.woshipm.com/pmd/3319143.html
下班前，请给我这100张原型图,枯叶,公众号：枯叶咖啡馆,2020-01-13,1.1万,19,14,7,http://www.woshipm.com/pmd/3319104.html
入行近一年的产品经理职场复盘,PM朱凯,产品源于生活,2020-01-13,1234,5,0,0,http://www.woshipm.com/pmd/3310687.html
